,developer,genres,name,platforms,publisher,release_date,review_date,score,user_score
437,"Ubisoft Romania, Ubisoft","Simulation, Flight",Blazing Angels: Squadrons of WWII,"PC,PlayStation 3,Wii,Xbox,Xbox 360","Ubisoft, D3Publisher","Mar 23, 2006","Mar 23, 2006",6.9,7.3
438,Nintendo Software Technology,"3D, Action, First-Person, Shooter",Metroid Prime: Hunters,DS,Nintendo,"Mar 20, 2006","Mar 23, 2006",8.6,8.8
439,Rockstar San Diego,"Simulation, Driving/Racing",Midnight Club 3: DUB Edition,"PlayStation 2,PlayStation 4,PSP,Xbox","Rockstar Games, SCEA","Apr 11, 2005","Mar 22, 2006",8.2,8.7
440,Rockstar San Diego,"Driving/Racing, Simulation",Midnight Club 3: DUB Edition,"PlayStation 2,PlayStation 4,PSP,Xbox","Rockstar Games, SCEA","Apr 11, 2005","Mar 22, 2006",8.2,8.7
441,8ing/Raizing,"3D, Fighting, Action",Naruto: Clash of Ninja,GameCube,"D3Publisher, Tomy Corporation","Mar 7, 2006","Mar 21, 2006",6.3,7.4
442,Harmonix Music Systems,Music/Rhythm,CMT Presents: Karaoke Revolution Country,PlayStation 2,Konami,"Mar 21, 2006","Mar 21, 2006",7.2,7.4
443,Digital Illusions,"First-Person, Shooter, Tactical, Action",Battlefield 2,PC,"Electronic Arts, EA Games","Jun 21, 2005","Mar 21, 2006",7.7,9.0
444,Digital Eclipse,Compilation,Capcom Classics Collection,"PlayStation 2,Xbox",Capcom,"Sep 27, 2005","Mar 21, 2006",7.8,8.0
445,Sony Online Entertainment,"Role-Playing, MMO",EverQuest II,PC,"Ubisoft, Sony Online Entertainment, Square Enix, Deep Silver","Nov 8, 2004","Mar 21, 2006",7.6,7.7
446,"Konami, Kojima Productions",Card Game,Metal Gear Acid 2,"Mobile,PSP","Glu Mobile, Konami","Mar 21, 2006","Mar 21, 2006",8.2,8.5
447,"Headgate, Page 44 Studios, EA Redwood Shores, Electronic Arts","Adventure, Action",The Godfather,"PC,PlayStation 2,PlayStation 3,PSP,Wii,Xbox,Xbox 360",Electronic Arts,"Mar 21, 2006","Mar 20, 2006",8.1,8.4
448,"Headgate, Page 44 Studios, EA Redwood Shores, Electronic Arts","Adventure, Action",The Godfather,"PC,PlayStation 2,PlayStation 3,PSP,Wii,Xbox,Xbox 360",Electronic Arts,"Mar 21, 2006","Mar 20, 2006",8.1,8.4
449,"Headgate, Page 44 Studios, EA Redwood Shores, Electronic Arts","Action, Adventure",The Godfather,"PC,PlayStation 2,PlayStation 3,PSP,Wii,Xbox,Xbox 360",Electronic Arts,"Mar 21, 2006","Mar 20, 2006",8.1,8.4
450,Kaolink,"2D, Action, Shooter",SWAT Force,Mobile,VU Games,"Feb 28, 2006","Mar 20, 2006",7.9,6.9
451,Now Production,"Action, Adventure",Katamari Damacy,PlayStation 2,"Bandai Namco Games, Namco, SCEA","Sep 21, 2004","Mar 17, 2006",8.0,8.7
452,Nintendo,"Puzzle, Matching/Stacking",Tetris DS,DS,Nintendo,"Mar 20, 2006","Mar 17, 2006",7.5,8.4
453,Sprout Games,Puzzle,Feeding Frenzy,"Mobile,PC,Xbox 360","In-Fusio, Oberon Media, MumboJumbo, Microsoft Game Studios",2005,"Mar 17, 2006",6.7,7.1
454,"GRIN, Ubisoft Shanghai, Ubisoft Paris","Action, First-Person, Shooter, Tactical",Tom Clancy's Ghost Recon Advanced Warfighter,"PC,PlayStation 2,Xbox,Xbox 360","Ubisoft, ak tronic","Mar 9, 2006","Mar 16, 2006",5.9,8.6
455,Turbine Inc.,"MMO, Role-Playing",Dungeons & Dragons Online,"Macintosh,PC","Warner Bros. Interactive Entertainment, Atari SA, Turbine Inc., Codemasters","Feb 28, 2006","Mar 16, 2006",7.5,7.6
456,"iwin, Inc., Big Blue Bubble Inc., iWin, PlayEveryWare Games","Puzzle, Matching/Stacking",Jewel Quest,"iOS (iPhone/iPad),Mobile,PC,Wii U,Xbox 360","iwin, Inc., I-Play, MumboJumbo, iWin, Microsoft Game Studios","Oct 29, 2004","Mar 16, 2006",6.8,7.5
457,Ready at Dawn,"3D, Platformer, Action",Daxter,PSP,"SCE Australia, SCEE, SCEI, SCEA","Mar 14, 2006","Mar 15, 2006",9.1,8.8
458,"CH GAMES CO.,LTD., CCR, Inc","MMO, Role-Playing",RF Online,"iOS (iPhone/iPad),PC","CH GAMES CO.,LTD., GamesCampus, Codemasters, CCR, CCR, Inc","Feb 21, 2006","Mar 15, 2006",6.6,7.3
459,Genius Sonority Inc.,"Puzzle, Matching/Stacking",Pokemon Trozei!,DS,Nintendo,"Mar 6, 2006","Mar 15, 2006",7.1,6.9
460,Legacy Interactive,Strategy,The Apprentice,PC,"Legacy Interactive, 505 Games","Feb 28, 2006","Mar 15, 2006",3.0,2.9
461,Aspect,Compilation,Metal Gear Solid 3: Subsistence,PlayStation 2,Konami,"Mar 14, 2006","Mar 14, 2006",9.0,9.5
462,Sony Bend,"Third-Person, Action, Shooter, Tactical",Syphon Filter: Dark Mirror,"PlayStation 2,PSP","SCEA, SCE Australia, SCEE","Mar 14, 2006","Mar 14, 2006",8.8,8.7
463,Reflections Interactive,"Action, Adventure",Driver: Parallel Lines,"PC,PlayStation 2,Wii,Xbox","Ubisoft, Atari SA, AQ Interactive","Mar 14, 2006","Mar 14, 2006",6.5,7.6
464,Reflections Interactive,"Adventure, Action",Driver: Parallel Lines,"PC,PlayStation 2,Wii,Xbox","Ubisoft, Atari SA, AQ Interactive","Mar 14, 2006","Mar 14, 2006",6.5,7.6
465,Omega Force,"Action, 2D, Beat-'Em-Up",Samurai Warriors: State of War,PSP,Koei,"Mar 7, 2006","Mar 14, 2006",6.5,7.4
466,Relic,"Action, Shooter, Tactical, Third-Person",The Outfit,Xbox 360,THQ,"Mar 13, 2006","Mar 13, 2006",6.7,7.2
467,"HyperDevbox Japan, Idea Factory","Strategy, Turn-Based",Generation of Chaos,"Android,PSP","HyperDevbox Japan, Idea Factory, Midas Interactive Entertainment, NIS America","Feb 28, 2006","Mar 13, 2006",6.6,7.4
468,Nautilus,Role-Playing,Shadow Hearts: From the New World,PlayStation 2,"Aruze Corp, Ghostlight, Xseed Games","Mar 7, 2006","Mar 13, 2006",8.2,8.5
469,Capcom,"Action, 2D, Platformer",Mega Man Powered Up,PSP,Capcom,"Mar 14, 2006","Mar 13, 2006",8.5,8.4
470,Handheld Games,"2D, Action, Platformer",Ratchet & Clank: Going Mobile,Mobile,Sony Pictures Digital Entertainment,"Nov 14, 2005","Mar 10, 2006",6.6,7.2
471,Dimps Corporation,"3D, Fighting, Action",Dragon Ball Z: Shin Budokai,PSP,"Atari SA, Bandai","Mar 7, 2006","Mar 9, 2006 ",7.5,8.6
472,"Exient Entertainment, EA Canada, Distinctive Developments Ltd","Team-Based, Arcade, Soccer, Sports",FIFA Street 2,"DS,GameCube,Mobile,PlayStation 2,PSP,Xbox","EA Sports Big, Electronic Arts","Feb 28, 2006","Mar 9, 2006 ",3.6,7.9
473,"Exient Entertainment, EA Canada, Distinctive Developments Ltd","Sports, Team-Based, Arcade, Soccer",FIFA Street 2,"DS,GameCube,Mobile,PlayStation 2,PSP,Xbox","EA Sports Big, Electronic Arts","Feb 28, 2006","Mar 9, 2006 ",5.8,7.9
474,2K Sports,"Sports, Team-Based, Basketball, Simulation",College Hoops 2K6,"PlayStation 2,Xbox,Xbox 360",2K Sports,"Nov 21, 2005","Mar 9, 2006 ",7.2,7.9
475,"Digital Chocolate, Sumea",Puzzle,Tower Bloxx,"BlackBerry,Mobile",Digital Chocolate,December 2005,"Mar 9, 2006 ",7.2,7.8
476,"GRIN, Ubisoft Shanghai, Ubisoft Paris","Action, First-Person, Shooter, Tactical",Tom Clancy's Ghost Recon Advanced Warfighter,"PC,PlayStation 2,Xbox,Xbox 360","Ubisoft, ak tronic","Mar 9, 2006","Mar 8, 2006 ",9.2,8.6
477,Maxis,Simulation,The Sims 2: Open for Business,"Macintosh,PC","EA Games, Electronic Arts","Feb 28, 2006","Mar 8, 2006 ",8.0,8.6
478,Bigbig Studios,Simulation,Pursuit Force,PSP,"SCEA, SCEE, SCE Korea, SCE Australia, Spike","Mar 7, 2006","Mar 7, 2006 ",8.0,8.1
479,Criterion Games,"Arcade, Driving/Racing",Burnout Revenge,"PlayStation 2,Xbox,Xbox 360",Electronic Arts,"Sep 13, 2005","Mar 6, 2006 ",8.8,9.0
480,Capcom,"Action, Adventure",Onimusha: Dawn of Dreams,PlayStation 2,Capcom,"Mar 7, 2006","Mar 6, 2006 ",8.0,8.8
481,"Exient Entertainment, EA Canada, Distinctive Developments Ltd","Arcade, Soccer, Sports, Team-Based",FIFA Street 2,"DS,GameCube,Mobile,PlayStation 2,PSP,Xbox","EA Sports Big, Electronic Arts","Feb 28, 2006","Mar 6, 2006 ",7.5,7.9
482,"Exient Entertainment, EA Canada, Distinctive Developments Ltd","Team-Based, Arcade, Soccer, Sports",FIFA Street 2,"DS,GameCube,Mobile,PlayStation 2,PSP,Xbox","EA Sports Big, Electronic Arts","Feb 28, 2006","Mar 6, 2006 ",7.5,7.9
483,"Exient Entertainment, EA Canada, Distinctive Developments Ltd","Arcade, Soccer, Sports, Team-Based",FIFA Street 2,"DS,GameCube,Mobile,PlayStation 2,PSP,Xbox","EA Sports Big, Electronic Arts","Feb 28, 2006","Mar 6, 2006 ",7.5,7.9
484,SCEA San Diego Studios,"Sports, Team-Based, Baseball, Simulation",MLB 06: The Show,"PlayStation 2,PSP","SCEA, SCE Korea","Feb 28, 2006","Mar 3, 2006 ",9.0,8.8
485,SCE Studio Cambridge,"Adventure, Action",24: The Game,PlayStation 2,"SCEE, SCE Australia, 2K Games","Feb 28, 2006","Mar 3, 2006 ",6.2,7.6
486,"Namco, Bandai Namco Games, Wolf Team","Role-Playing, Action",Tales of Phantasia,"Game Boy Advance,iOS (iPhone/iPad),PlayStation,PSP,Super Nintendo","Nintendo, Namco, Bandai Namco Games, Namco Bandai Games","Mar 6, 2006","Mar 3, 2006 ",7.2,8.6
487,Irrational Games,"Shooter, 3D, Action, First-Person",SWAT 4,PC,"Sierra Entertainment, Livedoor","Apr 5, 2005","Mar 2, 2006 ",8.2,8.6
488,"Falcom, Konami Software Shanghai","Role-Playing, Action",Ys: The Ark of Napishtim,"PC,PlayStation 2,PSP","Falcom, Xseed Games, Konami","Feb 22, 2005","Mar 2, 2006 ",6.7,8.0
489,Stardock,"Strategy, Turn-Based",Galactic Civilizations II: Dread Lords,PC,"Stardock, Kalypso","Feb 21, 2006","Mar 2, 2006 ",9.0,8.5
490,"THQ Wireless, Rainbow Studios","Driving/Racing, Simulation",MX vs. ATV Unleashed,"Mobile,PC,PlayStation 2,PlayStation 4,PSP,Xbox","THQ Wireless, THQ, Nordic Games Publishing, THQ Nordic","Mar 16, 2005","Mar 2, 2006 ",7.1,8.2
491,EA LA,"Strategy, Real-Time",The Lord of the Rings: The Battle for Middle-Earth II,"PC,Xbox 360","EA Games, Electronic Arts","Mar 2, 2006","Mar 2, 2006 ",8.3,8.6
492,"Capcom, Secret Level","Beat-'Em-Up, Action, 3D",Final Fight: Streetwise,"PlayStation 2,Xbox",Capcom,"Feb 28, 2006","Mar 1, 2006 ",3.3,6.1
493,Genki,"Simulation, Driving/Racing",Street Supremacy,PSP,"Genki, Konami","Feb 28, 2006","Mar 1, 2006 ",4.5,6.6
494,SCEA San Diego Studios,"Sports, Team-Based, Baseball, Simulation",MLB 06: The Show,"PlayStation 2,PSP","SCE Korea, SCEA","Feb 28, 2006","Mar 1, 2006 ",8.6,8.8
495,Mad Doc Software,"Real-Time, Strategy",Empire Earth II,PC,"VU Games, Sierra Entertainment","Apr 26, 2005","Mar 1, 2006 ",5.4,7.9
496,"Capcom, Secret Level","Beat-'Em-Up, 3D, Action",Final Fight: Streetwise,"PlayStation 2,Xbox",Capcom,"Feb 28, 2006","Mar 1, 2006 ",3.3,6.1
497,Sonic Team,"Driving/Racing, Arcade",Sonic Riders,"GameCube,PC,PlayStation 2,Xbox",Sega,"Feb 21, 2006","Mar 1, 2006 ",6.6,7.6
498,"Midway, Digital Eclipse",Compilation,Midway Arcade Treasures 3,"GameCube,PC,PlayStation 2,Xbox","Midway, Zoo Digital Publishing","Sep 26, 2005","Feb 28, 2006",5.7,6.9
499,Sega,Party/Minigame,Super Monkey Ball: Touch & Roll,DS,Sega,"Feb 21, 2006","Feb 28, 2006",6.6,7.0
500,"Codemasters, Sumo Digital","Driving/Racing, Simulation",TOCA Race Driver 3 Challenge,"Macintosh,PC,PlayStation 2,PSP,Xbox","Feral Interactive, Codemasters, Mastertronic, Interchannel-Holon","Feb 22, 2006","Feb 28, 2006",8.5,8.5
501,Sonic Team,"Arcade, Driving/Racing",Sonic Riders,"GameCube,PC,PlayStation 2,Xbox",Sega,"Feb 21, 2006","Feb 27, 2006",6.6,7.6
502,Sonic Team,"Driving/Racing, Arcade",Sonic Riders,"GameCube,PC,PlayStation 2,Xbox",Sega,"Feb 21, 2006","Feb 27, 2006",6.6,7.6
503,Bec,Role-Playing,MS Saga: A New Dawn,PlayStation 2,Bandai,"Feb 21, 2006","Feb 27, 2006",6.5,7.9
504,TOSE,"Platformer, Action, 2D",Super Princess Peach,DS,Nintendo,"Feb 27, 2006","Feb 24, 2006",7.2,7.9
505,"Codemasters, Sumo Digital","Simulation, Driving/Racing",TOCA Race Driver 3 Challenge,"Macintosh,PC,PlayStation 2,PSP,Xbox","Feral Interactive, Codemasters, Mastertronic, Interchannel-Holon","Feb 22, 2006","Feb 24, 2006",8.5,8.5
506,"Codemasters, Sumo Digital","Simulation, Driving/Racing",TOCA Race Driver 3 Challenge,"Macintosh,PC,PlayStation 2,PSP,Xbox","Feral Interactive, Codemasters, Mastertronic, Interchannel-Holon","Feb 22, 2006","Feb 24, 2006",8.5,8.5
507,DC Studios,"3D, Action, Shooter, Third-Person",State of Emergency 2,PlayStation 2,"SouthPeak Games, Spike","Feb 14, 2006","Feb 23, 2006",5.2,5.7
508,EA Chicago,"Boxing, Sports",Fight Night Round 3,"PlayStation 2,PlayStation 3,PSP,Xbox,Xbox 360","EA Sports, Electronic Arts","Feb 20, 2006","Feb 23, 2006",6.9,8.6
509,Criterion Games,"First-Person, Shooter, 3D, Action",Black,"PlayStation 2,Xbox","EA Games, Electronic Arts","Feb 28, 2006","Feb 23, 2006",7.4,8.3
510,Criterion Games,"3D, Action, First-Person, Shooter",Black,"PlayStation 2,Xbox","EA Games, Electronic Arts","Feb 28, 2006","Feb 23, 2006",7.4,8.3
511,EA Chicago,"Sports, Boxing",Fight Night Round 3,"PlayStation 2,PlayStation 3,PSP,Xbox,Xbox 360","EA Sports, Electronic Arts","Feb 20, 2006","Feb 21, 2006",8.3,8.6
512,EA Chicago,"Boxing, Sports",Fight Night Round 3,"PlayStation 2,PlayStation 3,PSP,Xbox,Xbox 360","EA Sports, Electronic Arts","Feb 20, 2006","Feb 21, 2006",8.2,8.6
513,EA Chicago,"Sports, Boxing",Fight Night Round 3,"PlayStation 2,PlayStation 3,PSP,Xbox,Xbox 360","EA Sports, Electronic Arts","Feb 20, 2006","Feb 21, 2006",8.2,8.6
514,SimBin,"Driving/Racing, Simulation",GT Legends,PC,"Libredia, Viva Media, LLC, Atari SA, SimBin","Jan 23, 2006","Feb 17, 2006",8.5,8.6
515,Racjin,"Sports, Snowboarding/Skiing",SBK: Snowboard Kids,DS,"ATLUS, Rising Star Games","Nov 22, 2005","Feb 17, 2006",6.7,7.7
516,Petroglyph,"Real-Time, Strategy",Star Wars: Empire at War,"Macintosh,PC","Aspyr, LucasArts, Activision","Feb 15, 2006","Feb 16, 2006",8.7,8.6
517,"Red Storm Entertainment, Ubisoft Montreal, Gameloft","Tactical, Action, First-Person, Shooter",Tom Clancy's Rainbow Six: Lockdown,"GameCube,Mobile,PC,PlayStation 2,Xbox","Ubisoft, Gameloft, Focus Multimedia","Jun 9, 2005","Feb 16, 2006",8.0,7.5
518,Pseudo Interactive,Simulation,Full Auto,Xbox 360,Sega,"Feb 14, 2006","Feb 15, 2006",6.5,7.3
519,"Nightlight Studios, Machineworks Northwest, WXP, Activision Value","Tactical, Action, First-Person, Shooter",Greg Hastings' Tournament Paintball Max'd,"DS,Game Boy Advance,PlayStation 2,Xbox","Activision, Activision Value","Oct 18, 2005","Feb 15, 2006",4.7,7.5
520,Game Arts,Role-Playing,Grandia III,"PlayStation 2,PlayStation 4","SCEA, Square Enix, Game Arts","Feb 14, 2006","Feb 15, 2006",7.6,8.4
521,Taito Corporation,Puzzle,Exit (2008),"PC,PSP,Xbox 360","Unbalance, Ubisoft, Taito Corporation","Feb 14, 2006","Feb 14, 2006",8.0,7.8
522,"Glu Mobile, Double Helix Games, The Collective","Action, Adventure",Marc Ecko's Getting Up: Contents Under Pressure,"Mobile,PC,PlayStation 2,Xbox","Glu Mobile, Atari SA, Devolver Digital, Mastertronic, Atari",September 2005,"Feb 14, 2006",8.7,8.3
523,"Glu Mobile, Double Helix Games, The Collective","Action, Adventure",Marc Ecko's Getting Up: Contents Under Pressure,"Mobile,PC,PlayStation 2,Xbox","Glu Mobile, Atari SA, Devolver Digital, Mastertronic, Atari",September 2005,"Feb 14, 2006",8.7,8.3
524,"Glu Mobile, Double Helix Games, The Collective","Action, Adventure",Marc Ecko's Getting Up: Contents Under Pressure,"Mobile,PC,PlayStation 2,Xbox","Glu Mobile, Atari SA, Devolver Digital, Mastertronic, Atari",September 2005,"Feb 14, 2006",8.4,8.3
525,Cavia Inc.,"Role-Playing, Action",Drakengard 2,PlayStation 2,"Ubisoft, Square Enix","Feb 14, 2006","Feb 14, 2006",7.0,8.2
526,EA Canada,"Sports, Team-Based",Rugby 06,"PC,PlayStation 2,Xbox",Electronic Arts,"Feb 14, 2006","Feb 14, 2006",7.6,8.1
527,EA Canada,"Sports, Team-Based",Rugby 06,"PC,PlayStation 2,Xbox",Electronic Arts,"Feb 14, 2006","Feb 14, 2006",7.6,8.1
528,"Torus Games, Monkey Bar Games","Action, Adventure",Curious George,"Game Boy Advance,GameCube,PC,PlayStation 2,Xbox","Namco, EA Games","Feb 1, 2006","Feb 14, 2006",6.6,6.1
529,Various,Compilation,Command & Conquer: The First Decade,PC,"Electronic Arts, EA Games","Feb 7, 2006","Feb 13, 2006",7.6,8.8
530,Backbone Entertainment,"Turn-Based, Strategy",Age of Empires: The Age of Kings,DS,Majesco Games,"Feb 14, 2006","Feb 13, 2006",8.2,8.2
531,"KCET, Konami","Sports, Team-Based, Simulation, Soccer",World Soccer Winning Eleven 9,"PC,PlayStation 2,PSP,Xbox",Konami,"Feb 7, 2006","Feb 10, 2006",8.8,8.9
532,"Nightlight Studios, WXP, Machineworks Northwest, Activision Value","Tactical, Action, First-Person, Shooter",Greg Hastings' Tournament Paintball Max'd,"DS,Game Boy Advance,PlayStation 2,Xbox","Activision, Activision Value","Oct 18, 2005","Feb 10, 2006",2.2,7.5
533,"Torus Games, Monkey Bar Games","Adventure, Action",Curious George,"Game Boy Advance,GameCube,PC,PlayStation 2,Xbox","Namco, EA Games","Feb 1, 2006","Feb 10, 2006",6.0,6.1
534,"Torus Games, Monkey Bar Games","Adventure, Action",Curious George,"Game Boy Advance,GameCube,PC,PlayStation 2,Xbox","Namco, EA Games","Feb 1, 2006","Feb 10, 2006",6.0,6.1
535,"Torus Games, Monkey Bar Games","Action, Adventure",Curious George,"Game Boy Advance,GameCube,PC,PlayStation 2,Xbox","Namco, EA Games","Feb 1, 2006","Feb 10, 2006",6.0,6.1
536,"Torus Games, Monkey Bar Games","Adventure, Action",Curious George,"Game Boy Advance,GameCube,PC,PlayStation 2,Xbox","Namco, EA Games","Feb 1, 2006","Feb 10, 2006",6.0,6.1
537,Brainbox Games,"Action, First-Person, Shooter, 3D",Land of the Dead: Road to Fiddler's Green,"PC,Xbox",Groove Games,"Oct 20, 2005","Feb 10, 2006",2.1,5.4
538,"KCET, Konami","Soccer, Sports, Team-Based, Simulation",World Soccer Winning Eleven 9,"PC,PlayStation 2,PSP,Xbox",Konami,"Feb 7, 2006","Feb 9, 2006 ",9.1,8.9
539,"KCET, Konami","Soccer, Sports, Team-Based, Simulation",World Soccer Winning Eleven 9,"PC,PlayStation 2,PSP,Xbox",Konami,"Feb 7, 2006","Feb 9, 2006 ",9.1,8.9
540,EA Tiburon,"Sports, Team-Based, Arcade, Football (American)",Arena Football (2006),"PlayStation 2,Xbox",EA Sports,"Feb 7, 2006","Feb 9, 2006 ",6.9,7.5
541,"Casady & Greene, Inc., Data East, Hands-On Mobile, Stainless Games","Action, Fixed-Screen, Shooter, 2D",Crystal Quest,"Amiga,Apple II,Game Boy,iOS (iPhone/iPad),Macintosh,PC,Xbox 360","Casady & Greene, Inc., Data East, Hands-On Mobile, MacSoft, Stainless Games, Microsoft Game Studios",1989,"Feb 8, 2006 ",6.2,6.6
542,EA Tiburon,"Arcade, Football (American), Sports, Team-Based",Arena Football (2006),"PlayStation 2,Xbox",EA Sports,"Feb 7, 2006","Feb 7, 2006 ",6.9,7.5
543,Sylum Entertainment,"Team-Based, First-Person, 3D, Shooter, Action",WWII Tank Commander,PC,"PAN Vision AB, ak tronic, Sylum Entertainment, Merscom LLC, Drive, Inc.","Feb 14, 2006","Feb 7, 2006 ",5.2,5.8
544,Namco,"Role-Playing, Action",Tales of Legendia,PlayStation 2,"Namco Bandai Games, SCEI, Namco","Feb 7, 2006","Feb 6, 2006 ",8.0,8.3
545,Sonic Team,Party/Minigame,The Rub Rabbits!,DS,Sega,"Feb 13, 2006","Feb 6, 2006 ",6.2,7.5
546,Skip Ltd.,"Action, Adventure",Chibi-Robo: Park Patrol,DS,Nintendo,"Oct 2, 2007","Feb 6, 2006 ",7.1,7.9
547,"Capcom, NexTech","3D, Action, Adventure, Survival",Resident Evil,"DS,PC,PlayStation,Saturn","Capcom, Nintendo, Virgin Interactive, PCHome, NEC, Media Kite, Tec Toy","Mar 30, 1996","Feb 6, 2006 ",7.9,8.7
548,"Capcom, Crawfish Interactive","Fighting, 2D, Action",Street Fighter Alpha 3,"Arcade Games,Dreamcast,Game Boy Advance,PlayStation,PSP,Saturn","Capcom, Virgin Interactive, THQ",1998,"Feb 6, 2006 ",8.2,8.6
549,"THQ Wireless, Rainbow Studios","Simulation, Driving/Racing",MX vs. ATV Unleashed,"Mobile,PC,PlayStation 2,PlayStation 4,PSP,Xbox","THQ Wireless, Nordic Games Publishing, THQ, THQ Nordic","Mar 16, 2005","Feb 3, 2006 ",7.7,8.2
550,Direct Action Games,"Shooter, 3D, Action, First-Person",World War II Combat: Road to Berlin,"PC,Xbox",Groove Games,"Jan 24, 2006","Feb 3, 2006 ",2.0,3.9
551,IR Gurus,"Simulation, Flight",Heroes of the Pacific,"PC,PlayStation 2,Xbox","Sold Out Software, Codemasters, Ubisoft","Sep 28, 2005","Feb 2, 2006 ",7.0,7.9
552,NanaOn-Sha,Strategy,Tamagotchi Connection: Corner Shop,DS,"Bandai, Atari SA","Jan 31, 2006","Feb 1, 2006 ",6.4,6.8
553,Eutechnyx,"Driving/Racing, Simulation",Ford vs. Chevy,"PlayStation 2,Xbox",Global Star Software,"Nov 9, 2005","Feb 1, 2006 ",5.0,6.0
554,Eutechnyx,"Simulation, Driving/Racing",Ford vs. Chevy,"PlayStation 2,Xbox",Global Star Software,"Nov 9, 2005","Feb 1, 2006 ",5.0,6.0
555,AWE Games,"3D, Adventure, Third-Person",Agatha Christie: And Then There Were None,"PC,Wii",The Adventure Company,"Oct 30, 2005","Jan 31, 2006",6.4,7.1
556,Empire Oxford,Compilation,Taito Legends,"PC,PlayStation 2,Xbox","Sega, Taito Corporation, Empire Interactive","Oct 25, 2005","Jan 31, 2006",7.1,7.4
557,Capcom,"Action, 2D, Platformer",Mega Man Maverick Hunter X,PSP,Capcom,"Jan 31, 2006","Jan 30, 2006",8.1,8.7
558,Ideaworks3D,Simulation,The Sims 2 Mobile,Mobile,Electronic Arts,Q4 2005,"Jan 30, 2006",6.0,6.4
559,"Climax Group, PlayFirst, Other Ocean Interactive, GameLab, Glu Mobile, Hudson","Puzzle, Action",Diner Dash,"DS,iOS (iPhone/iPad),Macintosh,Mobile,PC,PlayStation 3,PSP,Wii,Xbox 360","Eidos Interactive, PlayFirst, Glu Mobile, Big Fish Games, Hudson","Dec 3, 2003","Jan 30, 2006",8.0,7.4
560,Game Freak,"Action, 2D, Platformer",Drill Dozer,Game Boy Advance,Nintendo,"Feb 6, 2006","Jan 27, 2006",8.2,8.3
561,Frogwares,"Third-Person, Adventure, 3D",80 Days (2005),PC,"Focus Home Interactive, Matrix Games, Peter Games","Dec 12, 2005","Jan 27, 2006",5.1,6.2
562,GarageGames,"3D, Platformer, Action",Marble Blast Ultra,Xbox 360,GarageGames,"Jan 23, 2006","Jan 27, 2006",6.8,7.9
563,"I-Play, 49Games",Sports,Torino 2006 - The Official Video Game of the XX Olympic Winter Games,"Mobile,PC,PlayStation 2,Xbox","I-Play, 2K Sports","Jan 24, 2006","Jan 26, 2006",3.9,5.5
564,"I-Play, 49Games",Sports,Torino 2006 - The Official Video Game of the XX Olympic Winter Games,"Mobile,PC,PlayStation 2,Xbox","I-Play, 2K Sports","Jan 24, 2006","Jan 26, 2006",3.9,5.5
565,"I-Play, 49Games",Sports,Torino 2006 - The Official Video Game of the XX Olympic Winter Games,"Mobile,PC,PlayStation 2,Xbox","I-Play, 2K Sports","Jan 24, 2006","Jan 26, 2006",3.9,5.5
566,"Yuki, SNK Playmore","Action, 2D, Fighting",Samurai Shodown V,"Arcade Games,NeoGeo,PlayStation 2,Xbox","SNK Playmore, Ignition Entertainment","Dec 11, 2003","Jan 25, 2006",6.9,7.5
567,Silver Creek Entertainment,Trivia/Board Game,Hardwood Spades,"iOS (iPhone/iPad),Xbox 360","Silver Creek Entertainment, Microsoft Game Studios","Dec 8, 2005","Jan 25, 2006",6.2,6.5
568,Silver Creek Entertainment,Trivia/Board Game,Hardwood Hearts,"iOS (iPhone/iPad),Xbox 360","Silver Creek Entertainment, Microsoft Game Studios","Dec 8, 2005","Jan 25, 2006",6.1,6.5
569,"Sourcenext, Capcom","Action, Adventure",Devil May Cry 3: Special Edition,"PC,PlayStation 2","Capcom, Sourcenext, Ubisoft, Mastertronic, Valve Software, Sold Out Software","Jan 24, 2006","Jan 24, 2006",8.2,8.9
570,ChessBase,Trivia/Board Game,Fritz 9: Play Chess,PC,"Viva Media, LLC","Dec 15, 2005","Jan 24, 2006",6.9,7.7
571,Warthog,"Platformer, 3D, Action",Animaniacs: The Great Edgar Hunt,"GameCube,Xbox",Ignition Entertainment,"Aug 29, 2005","Jan 24, 2006",7.1,7.0
572,"Climax Group, Blue Tongue Entertainment, THQ","Platformer, 3D, Action",Nicktoons Unite!,"DS,Game Boy Advance,GameCube,PlayStation 2",THQ,"Oct 26, 2005","Jan 24, 2006",5.6,6.6
573,EA Canada,"Simulation, Sports, Team-Based, Baseball",MVP 06 NCAA Baseball,"PlayStation 2,Xbox",EA Sports,"Jan 18, 2006","Jan 23, 2006",8.0,8.5
574,EA Canada,"Team-Based, Baseball, Simulation, Sports",MVP 06 NCAA Baseball,"PlayStation 2,Xbox",EA Sports,"Jan 18, 2006","Jan 23, 2006",8.0,8.5
575,Mobliss,"Fighting, 2D, Action",Brady Bunch Kung Fu,Mobile,Mobliss,"Dec 8, 2005","Jan 23, 2006",7.2,
576,I-Play,"2D, Action, Fighting",The King of Fighters M2,Mobile,I-Play,Q3 2005,"Jan 23, 2006",3.3,5.5
577,THQ Wireless,"Action, Fighting, Wrestling",WWE SmackDown!,Mobile,THQ Wireless,February 2005,"Jan 23, 2006",6.1,6.0
578,"EA Canada, Ideaworks3D, Black Box","Simulation, Driving/Racing",Need for Speed: Most Wanted,"DS,Game Boy Advance,GameCube,Mobile,PC,PlayStation 2,PSP,Xbox,Xbox 360","Electronic Arts, EA Games","Nov 15, 2005","Jan 20, 2006",6.6,8.7
579,Techland,"Action, First-Person, Shooter, 3D",Chrome SpecForce,PC,"TopWare Interactive, Meridian4, Deep Silver","Nov 30, 2005","Jan 20, 2006",5.2,7.0
580,FAKT Software,Puzzle,Crazy Machines: The Wacky Contraptions Game,"Macintosh,PC","Viva Media, LLC",October 2005,"Jan 20, 2006",7.7,8.0
581,T&E Soft,"Golf, Arcade, Sports",True Swing Golf,DS,Nintendo,"Jan 23, 2006","Jan 20, 2006",6.0,7.4
582,Eighting,"3D, Action, Fighting",Zatch Bell! Mamodo Battles,"GameCube,PlayStation 2",Bandai,"Oct 19, 2005","Jan 19, 2006",4.4,7.5
583,TOSE,Gambling,Sega Casino,DS,Sega,Q4 2005,"Jan 19, 2006",5.8,6.5
584,"Avalanche Software, Ritual Entertainment","Shooter, Third-Person, 3D, Action",25 to Life,"PC,PlayStation 2,Xbox","Eidos Interactive, Atari SA","Jan 17, 2006","Jan 19, 2006",5.7,5.8
585,"Avalanche Software, Ritual Entertainment","Third-Person, 3D, Action, Shooter",25 to Life,"PC,PlayStation 2,Xbox","Eidos Interactive, Atari SA","Jan 17, 2006","Jan 19, 2006",5.7,5.8
586,"Avalanche Software, Ritual Entertainment","Shooter, Third-Person, 3D, Action",25 to Life,"PC,PlayStation 2,Xbox","Eidos Interactive, Atari SA","Jan 17, 2006","Jan 19, 2006",5.6,5.8
587,G5 Software,Strategy,Cuban Missile Crisis: The Aftermath,PC,"Strategy First, 1C","Dec 22, 2005","Jan 18, 2006",6.9,6.9
588,SCE Japan Studio,"Platformer, Action, 3D",Ape Escape 3,"PlayStation 2,PlayStation 4","SCEA, SCEE, SCEI, SCE Korea","Jan 17, 2006","Jan 17, 2006",8.2,8.6
589,Shift,Party/Minigame,Ape Escape Academy,PSP,"SCEI, SCE Australia, SCEE, SCEA","Jan 17, 2006","Jan 17, 2006",6.1,6.9
590,"Amaze Entertainment, Traveller's Tales, UIEvolution","Adventure, Action","The Chronicles of Narnia: The Lion, The Witch and The Wardrobe","DS,Game Boy Advance,GameCube,Mobile,PC,PlayStation 2,Xbox","Buena Vista Games, D3Publisher, Disney Interactive Studios, Disney Mobile Studios, SCEA","Nov 14, 2005","Jan 17, 2006",7.0,7.1
591,Crave,Trivia/Board Game,The Bible Game,"Game Boy Advance,PlayStation 2,Xbox",Crave,"Oct 23, 2005","Jan 17, 2006",5.4,5.6
592,Crave,Trivia/Board Game,The Bible Game,"Game Boy Advance,PlayStation 2,Xbox",Crave,"Oct 23, 2005","Jan 17, 2006",5.4,5.6
593,"Human Soft, Blitz Games","Platformer, 3D, Action",Pac-Man World 3,"DS,GameCube,PC,PlayStation 2,PSP,Xbox","Namco, Electronic Arts","Nov 15, 2005","Jan 17, 2006",6.3,7.3
594,"Konami, KCE Studios","Beat-'Em-Up, Action, 2D",Teenage Mutant Ninja Turtles 3: Mutant Nightmare,"DS,GameCube,PlayStation 2,Xbox",Konami,"Nov 1, 2005","Jan 13, 2006",6.1,7.2
